{
  "schema_version": "1.1.0",
  "suite_id": "v0_5_development_25",
  "dataset_version": "0.1.0",
  "benchmark_status": "development",
  "description": "Twenty-five-case development suite for retrieval, evidence sufficiency, abstention, and multi-paper coverage. The first ten cases preserve the reviewed R10 baseline slice exactly. LLM judge output is advisory and does not make this suite held-out or publishable.",
  "cases": [
    {
      "case_id": "transformer_scaled_dot_product_reason",
      "question": "Why does the Transformer scale dot-product attention by 1/sqrt(d_k)?",
      "question_type": "method",
      "evaluation_split": "development",
      "provenance": {
        "kind": "repo_curated",
        "dataset_name": "v0.5 internal development benchmark",
        "dataset_version": "0.1.0",
        "source_url": "https://arxiv.org/abs/1706.03762v7",
        "source_case_id": "transformer_scaled_dot_product_reason",
        "source_split": "development",
        "license": "Source paper terms apply; distributed by arXiv.",
        "adaptation_notes": "Question and rubric authored from the pinned v7 full text."
      },
      "annotation": {
        "source": "repo_authored",
        "annotator_count": 1,
        "reviewer_count": 1,
        "adjudicated": true,
        "notes": "Independently source-audited on 2026-08-30 against checksum-pinned Transformer v7 page 4; the question, answer criteria, reference answer, and evidence anchor were retained without change. The automated judge remains advisory."
      },
      "papers": [
        {
          "paper_id": "1706.03762",
          "versioned_id": "1706.03762v7",
          "revision": 7,
          "title": "Attention Is All You Need"
        }
      ],
      "expected": {
        "decision": "answer",
        "required_paper_ids": ["1706.03762v7"],
        "reference_answer": "For large key dimensions, unscaled dot products can grow large, push softmax into regions with extremely small gradients, and impair learning; dividing by sqrt(d_k) counteracts that effect.",
        "answer_criteria": [
          {
            "criterion_id": "large_dot_products",
            "description": "States that dot-product magnitude grows for large key dimensions.",
            "required": true
          },
          {
            "criterion_id": "small_softmax_gradients",
            "description": "Connects large logits to softmax regions with extremely small gradients.",
            "required": true
          },
          {
            "criterion_id": "scaling_counteracts",
            "description": "States that the 1/sqrt(d_k) factor counteracts this effect.",
            "required": true
          }
        ],
        "forbidden_claims": [
          "Claims the scaling factor was selected from a reported BLEU ablation."
        ]
      },
      "gold_evidence": [
        {
          "evidence_id": "scaled_attention_reason_p4",
          "evidence_group_id": "scaled_attention_reason",
          "paper_id": "1706.03762",
          "versioned_id": "1706.03762v7",
          "source_type": "full_text",
          "page": 4,
          "section": "3.2.1 Scaled Dot-Product Attention",
          "quote": "We suspect that for large values of d_k, the dot products grow large in magnitude, pushing the softmax function into regions where it has extremely small gradients. To counteract this effect, we scale the dot products by 1/sqrt(d_k).",
          "supports": ["large_dot_products", "small_softmax_gradients", "scaling_counteracts"]
        }
      ],
      "tags": ["single-paper", "positive", "method"]
    },
    {
      "case_id": "transformer_sinusoidal_position_reason",
      "question": "Why did the Transformer authors choose sinusoidal positional encodings instead of learned positional embeddings?",
      "question_type": "method",
      "evaluation_split": "development",
      "provenance": {
        "kind": "repo_curated",
        "dataset_name": "v0.5 internal development benchmark",
        "dataset_version": "0.1.0",
        "source_url": "https://arxiv.org/abs/1706.03762v7",
        "source_case_id": "transformer_sinusoidal_position_reason",
        "source_split": "development",
        "license": "Source paper terms apply; distributed by arXiv.",
        "adaptation_notes": "Question and rubric authored from the pinned v7 full text."
      },
      "annotation": {
        "source": "repo_authored",
        "annotator_count": 1,
        "reviewer_count": 1,
        "adjudicated": true,
        "notes": "Independently source-audited on 2026-08-30 against checksum-pinned Transformer v7 page 6; the question, answer criteria, reference answer, and evidence anchor were retained without change. The automated judge remains advisory."
      },
      "papers": [
        {
          "paper_id": "1706.03762",
          "versioned_id": "1706.03762v7",
          "revision": 7,
          "title": "Attention Is All You Need"
        }
      ],
      "expected": {
        "decision": "answer",
        "required_paper_ids": ["1706.03762v7"],
        "reference_answer": "Learned and sinusoidal positional encodings produced nearly identical results, but the authors chose the sinusoidal version because it might extrapolate to sequence lengths longer than those seen during training.",
        "answer_criteria": [
          {
            "criterion_id": "similar_results",
            "description": "States that learned and sinusoidal positional encodings gave nearly identical results.",
            "required": true
          },
          {
            "criterion_id": "length_extrapolation",
            "description": "States that sinusoidal encodings may extrapolate to longer unseen sequence lengths.",
            "required": true
          }
        ],
        "forbidden_claims": [
          "Claims the sinusoidal version achieved a reported accuracy improvement over learned embeddings."
        ]
      },
      "gold_evidence": [
        {
          "evidence_id": "sinusoidal_choice_p6",
          "evidence_group_id": "sinusoidal_choice",
          "paper_id": "1706.03762",
          "versioned_id": "1706.03762v7",
          "source_type": "full_text",
          "page": 6,
          "section": "3.5 Positional Encoding",
          "quote": "We also experimented with using learned positional embeddings instead, and found that the two versions produced nearly identical results. We chose the sinusoidal version because it may allow the model to extrapolate to sequence lengths longer than the ones encountered during training.",
          "supports": ["similar_results", "length_extrapolation"]
        }
      ],
      "tags": ["single-paper", "positive", "method"]
    },
    {
      "case_id": "transformer_wmt14_en_de_result",
      "question": "What BLEU score did Transformer (big) achieve on WMT 2014 English-to-German, and how did it compare with prior reported systems?",
      "question_type": "result",
      "evaluation_split": "development",
      "provenance": {
        "kind": "repo_curated",
        "dataset_name": "v0.5 internal development benchmark",
        "dataset_version": "0.1.0",
        "source_url": "https://arxiv.org/abs/1706.03762v7",
        "source_case_id": "transformer_wmt14_en_de_result",
        "source_split": "development",
        "license": "Source paper terms apply; distributed by arXiv.",
        "adaptation_notes": "Question and rubric authored from the pinned v7 full text."
      },
      "annotation": {
        "source": "repo_authored",
        "annotator_count": 1,
        "reviewer_count": 1,
        "adjudicated": true,
        "notes": "Independently source-audited on 2026-08-30 against checksum-pinned Transformer v7 page 8, including Table 2 and its surrounding text; the annotation was retained without change. The automated judge remains advisory."
      },
      "papers": [
        {
          "paper_id": "1706.03762",
          "versioned_id": "1706.03762v7",
          "revision": 7,
          "title": "Attention Is All You Need"
        }
      ],
      "expected": {
        "decision": "answer",
        "required_paper_ids": ["1706.03762v7"],
        "reference_answer": "Transformer (big) achieved 28.4 BLEU, more than 2.0 BLEU above the best previously reported systems, including ensembles, establishing a new state of the art for that task.",
        "answer_criteria": [
          {
            "criterion_id": "bleu_28_4",
            "description": "Reports the 28.4 BLEU score.",
            "required": true
          },
          {
            "criterion_id": "over_two_bleu",
            "description": "Reports an improvement of more than 2.0 BLEU over prior systems including ensembles.",
            "required": true
          }
        ],
        "forbidden_claims": [
          "Reports the English-to-French BLEU score as the English-to-German result."
        ]
      },
      "gold_evidence": [
        {
          "evidence_id": "wmt14_en_de_result_p8",
          "evidence_group_id": "wmt14_en_de_result",
          "paper_id": "1706.03762",
          "versioned_id": "1706.03762v7",
          "source_type": "full_text",
          "page": 8,
          "section": "6.1 Machine Translation",
          "quote": "On the WMT 2014 English-to-German translation task, the big transformer model outperforms the best previously reported models (including ensembles) by more than 2.0 BLEU, establishing a new state-of-the-art BLEU score of 28.4.",
          "supports": ["bleu_28_4", "over_two_bleu"]
        }
      ],
      "tags": ["single-paper", "positive", "result", "numeric"]
    },
    {
      "case_id": "bert_masked_lm_mechanism",
      "question": "How does BERT's masked language model objective enable deep bidirectional pre-training?",
      "question_type": "method",
      "evaluation_split": "development",
      "provenance": {
        "kind": "repo_curated",
        "dataset_name": "v0.5 internal development benchmark",